{
  "id": "scan-include-exclude-priority",
  "specRefs": ["BC-32", "BC-33", "OF-03"],
  "fixture": {
    "projects": [{ "dir": "zone/both/app" }, { "dir": "zone/self/proj" }]
  },
  "setup": [
    {
      "write": {
        "path": "config.json",
        "text": "{\n  \"roots\": [\"$FIXTURE/zone\"],\n  \"exclude\": [\"both\"],\n  \"include\": [\"both\", \"self\"]\n}\n"
      }
    }
  ],
  "run": {
    "env": { "SWEEP_NM_CONFIG": "$FIXTURE/config.json" }
  },
  "expect": {
    "exitCode": 0,
    "stdoutExact": "▍ SWEEP-NM  预览 · 1 个根: $FIXTURE/zone\n  ▒ 8 KB  proj    $FIXTURE/zone/self/proj\n  █ 合计 1 处 · 8 KB   加 --yes 执行删除\n",
    "stdoutMustNotContain": ["app"],
    "stderrMustNotContain": ["包含名未匹配", "包含名单无一条命中"]
  }
}
