{
  "id": "render-banner-4-roots",
  "specRefs": ["OF-01"],
  "fixture": {},
  "setup": [
    { "write": { "path": "z1/.keep", "text": "" } },
    { "write": { "path": "z2/.keep", "text": "" } },
    { "write": { "path": "z3/.keep", "text": "" } },
    { "write": { "path": "z4/.keep", "text": "" } },
    {
      "write": {
        "path": "config.json",
        "text": "{\n  \"roots\": [\"$FIXTURE/z1\", \"$FIXTURE/z2\", \"$FIXTURE/z3\", \"$FIXTURE/z4\"],\n  \"exclude\": []\n}\n"
      }
    }
  ],
  "run": {
    "env": { "SWEEP_NM_CONFIG": "$FIXTURE/config.json" }
  },
  "expect": {
    "exitCode": 0,
    "stdoutExact": "▍ SWEEP-NM  预览 · 4 个根\n  ░ 未发现 node_modules\n"
  }
}
